contentful_id,ext_id,name,type,address,lat,lon,status,atm_cash_in,work_on_weekend,full_day,working_time,weekdays,saturdays,phone,atm_branch_image
1BiHlIRqRavgu2VsApwF7a,2029,ATM RIM YEV ARAN DALGA MARKET,ATM,"Yevlax rayonu, Aran qəsəbəsi 2, Bakı- Gəncə şossesinin kənarında yerləşən Dalğa market",40.63159542229465,46.98894310886099,,False,,,,,,,
48uIpATv7TGzCVY1qC8eil,1006,"ATM CCS, AZERFON MMC",ATM,"Bakı, Nərimanov rayonu, H.Əliyev pr. 106A (""Azerfon"" şirkəti)",40.416694,49.90886,,False,,,,,,,
5EJ9QktxV08R7iiuAalDbE,2499,ATM CNV NASIMI BRANCH 1 GRG,ATM,"Bakı, Nəsimi rayonu, 28 may küç. 21A (ABB-nin Nəsimi filialı)",40.377333,49.849699,,True,,,,,,,
jkhv8hZXZE3mBhYCRkQwD,591,ATM CNV BAKI SAGLAMLIQ MERKEZI,ATM,"Bakı ş., Nəsimi rayonu, N.Yusifbəyli küç.(Azadlıq pr.kəsişməsi),Bakı Sağlamlıq Mərkəzi ",40.398583,49.83981,,False,,,,,,,
gUx1RqEwkVo6GRvhkeJKT,1754,ATM CNV HADRUT BOLMART,ATM,"Xocavənd rayonu, Hadrut (Bolmart market)",39.517771626926155,47.03089620531888,,False,,,,,,,
2WH5LLPv6GR7MLyTXLPwCj,1180,ATM RIM SHEKI  BASH GOYNUK,ATM,"Şəki, Şəki, Baş Göynük  (mağaza)",41.3271077,47.128171,,False,,,,,,,
41MVZG0G0kX0HD1sElEVzb,1061,ATM RIM SHEKI ASHAGI GOYNUK,ATM,"Şəki şəhəri, Aşağı Göynük kəndi (“Ulduz” market)",41.2710919,47.0121229,,False,,,,,,,
2heoTINUdN9t8d4rXyyokO,1103,ATM RIM SHEKI BASH ZEYZID,ATM,"Şəki, Orta zəhzid qəsəbəsi",41.1808773,47.2397094,,False,,,,,,,
7gJ3tw6gJ9StlMgiLsoqQu,2410,ATM RIM OGUZ SHEKI BRANCH,ATM,"Şəki, Şəki, H.Əliyev küçəsi 61 A (ABB Şəki filialı)",41.204913833665636,47.177686321754486,,True,,,,,,,
2hJs8oCvzR7yEl58qOBreI,333,ATM RIM SHEKI MERKEZI XESTEXANA,ATM,"Şəki, N.Nərimanov küçəsi (24 market)",41.1575006,47.1797249,,False,,,,,,,
43xEOop9JcGpD6bqlYIb14,894,ATM RIM SHEKI DAG DIBI,ATM,"Şəki, Şəki, N.Nərimanov küçəsi 2 (Dağdibi)",41.1649494,47.1826243,,False,,,,,,,
74Y6LJiQZWGPKMObstW0WZ,67,ATM OGUZ RIM SHEKI TURAN QASABA,ATM,"Şəki, Turan",40.8576279,47.2439433,,False,,,,,,,
VJhDaDeqnUaZytwt7f2ax,465,ATM RIM SHEKI EKONOM MARKET,ATM,"Şəki şəhəri,  M.Ə.Rəsulzadə, 89 (Ekonom market)",41.2021738,47.1778313,,False,,,,,,,
2tfIm0Y0hAIOAnuBpTYaLx,728,ATM RIM SHEKI BAZARSTORE,ATM,Şəki şəhəri Mikayl Müşfiq küçəsi,41.2011884,47.168241,,False,,,,,,,
2C2Qnu8Oaj0Nd4wBC6OVMp,1848,ATM RIM SHEKI QOXMUQ,ATM,"Şəki, Qoxmuq kəndi ( ərzaq dükanı )",41.2117144,47.1336442,,False,,,,,,,
3UkRfriysxUJry8AN73OW5,10,"ATM CCS, BP, BAKU",ATM,"Bakı, Nəsimi rayonu, Neftçilər pr, 153 (ABB-nin şöbəsi -BP ”Port Baku” (şimal))",40.376254,49.861194,,False,,,,,,,
3xzRCOYMoXjbYtQVRfbW28,733,"ATM SUR, YENI SURAXANI, MARKET",ATM,"Bakı, Suraxanı rayonu, Yeni Suraxanı qəsəbəsi, 14 Iyul küçəsi (market)",40.43295761125316,50.03292205500093,,False,,,,,,,
5dUbxI2MVeFlDvHSMc1m3c,32,ATM CNV NARDARAN OBA MARKET,ATM,"Bakı, Sabunçu rayonu, Nardaran qəs. (Oba market)",40.55756251609222,50.00794099965487,,False,,,,,,,
3UUwaFYjb2E2dRqd73V99w,223,ATM CNV OBA MARKET A ORUCALIYEV 5C,ATM,"Bakı, Nərimanov rayonu, Əlicabbar Orucəliyev 5C, (Oba market)",40.396229,49.875553,,False,,,,,,,
2mDV02JBlYMz1JDaQqvkkL,226,"ATM CNV, GOZ ALIL.CAMIYY N. 226",ATM,"Bakı, Nərimanov rayonu, Faiq Yusifov 40, (Azərbaycan gözdən əlillər cəmiyyəti (inzibari bina)",40.408137,49.870213,,False,,,,,,,
3UagfduJqk7fbGgccT7zGs,2417,ATM CNV NARIMANOV BRANCH WR,ATM,"Bakı, Nərimanov r. Akademik H.Əliyev 94 (Nərimanov filialı)",40.403353,49.854161,,True,,,,,,,
HkrnaCUWOeq9qy5LqNF4a,2174,ATM CNV NASIMI BRANCH-1 NR,ATM,"Bakı, Nəsimi rayonu, 28 may küç. 21A  (ABB-nin Nəsimi filialı)",40.377333,49.849699,,True,,,,,,,
lbVG4Cp7a7BDxKOZby71R,2220,ATM CNV NEPTUN C.MEMMED-E REC,ATM,Nəsimi r. C. Məmmədquluzadə 939,40.395064,49.828103,,True,,,,,,,
5cPdLkLGhs5HVh5yBPjhLv,2249,ATM CNV BOLMART GOY MECID REC,ATM,"Nəsimi r-nu, Səməd Vurğun küç., 75 B (Bol Mart Sirk ilə üz-bə-üz)",40.383959,49.837863,,True,,,,,,,
53i8iflD89FFRrAkXJKcbm,2258,ATM CNV OBA MARKET 28 MAY REC,ATM,Nəsimi r. Rəşid Behbudov küç. OBA market,40.38099925409084,49.84448618926151,,True,,,,,,,
62Wfbc3XxviSeNaiiu0Vom,2277,ATM CNV ARAZ M. USA EMB REC,ATM,Nəsimi r. Azadlıq pr. Eldar Tağızadə küç. (ABŞ səfirliyi yanı),40.38508766296593,49.844492075089924,,True,,,,,,,
5CnfegS4WgsHQIqePCpfUV,2380,"ATM CNV BEKO, 28 MAY STR. 72 WR",ATM,"Bakı, Səbail rayonu, 28 may küçəsi 72 (Beko mağazası)",40.379162,49.857386,,True,,,,,,,
4HA5JiC7VMWv8EI5vm3P2A,2467,ATM CNV ECEMI BRANCH 1 GRG,ATM,"Bakı ş., Nəsimi r. Məmmədcəfər Cəfərov 28 (ABB Əcəmi filialı)",40.407115,49.811858,,True,,,,,,,
6FxEwp8tbUtRRyZOL1s9Ry,2468,ATM CNV ECEMI BRANCH 2 GRG,ATM,"Bakı ş., Nəsimi r. Məmmədcəfər Cəfərov 28 (ABB Əcəmi filialı)",40.407115,49.811858,,True,,,,,,,
F0NMt2Oo7VJH30VkddSrJ,2500,ATM CNV NASIMI BRANCH 2 GRG,ATM,"Bakı, Nəsimi rayonu, 28 may küç. 21A (ABB-nin Nəsimi filialı)",40.377333,49.849699,,True,,,,,,,
4ySzjoDmRUCcMvmh798k2x,2491,ATM CNV 28 MALL TM,ATM,"Bakı şəhəri, Azadlıq prospekti ilə Füzuli küçəsinin kəsişməsi, "" 28 Mall ""  Ticarət mərkəzi",40.379126,49.846945,,False,,,,,,,
3CDA8qjodWYXeNVcA2XeBS,377,ATM CNV BADAMDAR ARAZ MARKET,ATM,"Bakı, Səbayıl r-nu, Badamdar şossesi, 34",40.351064,49.810626,,False,,,,,,,
4cW8daDIyJXiHYaPnoaqUF,2191,ATM CNV KITAB EVI REC 1,ATM,"Bakı, Səbail rayonu, Nigar Rəfibəyli küçəsi 29 (Kitab evi)",40.37154,49.8366995,,True,,,,,,,
3WLuVEansv9FVpQW6VcfbN,2211,ATM CNV KITAB EVI REC 2,ATM,"Bakı, Səbail rayonu, Nigar Rəfibəyli küçəsi 29 (Kitab evi)",40.37154,49.8366995,,True,,,,,,,
413kmeGhh9hZTrvgTWdFl8,2212,ATM CNV KITAB EVI REC 3,ATM,"Bakı, Səbail rayonu, Nigar Rəfibəyli küçəsi 29 (Kitab evi)",40.37154,49.8366995,,True,,,,,,,
kd9A9lBiDzkJaLymelgU3,162,ATM RIM GUB XACHMAZ GAYALI,ATM,"Xaçmaz, N.Nərimanov küç.  Qayalı market",41.46372432119405,48.801711016277196,,False,,,,,,,https://images.ctfassets.net/rckhx7d9app2/52re4778eD4WZ7WGdt03K9/81017a77d35456e29c471b70cd3fdb8e/162_Sayl__ATM.jpeg
44bwtERhf6rK7GSdpmS5rJ,192,ATM RIM GAN HASAN MARKET,ATM,"Gəncə ş., (Həsən market)",40.68702083480114,46.375527204174574,,False,,,,,,,https://images.ctfassets.net/rckhx7d9app2/2elrl8OmigjvlU270E2oQt/9d5be461a96a1dde8c1a1c0ee6bd8848/189_Sayl__ATM.jpeg
3B21Rbisdj5qrNq8tODarf,212,ATM RIM YEV MALBINESI OBA M.,ATM,"Yevlax ray., Malbinesi k. (Oba market)",40.50497091110216,47.093229336233456,,False,,,,,,,https://images.ctfassets.net/rckhx7d9app2/3kwDIy7a13sPUhvY7t4MaT/2133ed651eb1b2813f7280de2d3942c4/212_Sayl__ATM.jpg
2B9rnWHIxuMaQ81v0FJghH,1553,ATM CNV SOCAR BIBIHEYBAT,ATM,"Bakı, Səbail rayonu, Bakı-Səlyan şos. Bibi heybət məsçidi (Socar YDM)",40.318558,49.821734,,False,,,,,,,
1fQR0XLEqQiTG8e7fVhZQs,2177,ATM CNV FAIRMONT HOTEL NR,ATM,"Bakı, Mehdi Hüseynzadə 1A",40.359743,49.827002,,True,,,,,,,
YHkBT2O3OYZRAQS3KqBsM,2194,ATM GAR GARADAGH BRANCH NR,ATM,Səbail Q.Abbasov küşəsi 29 (ABB Qaradağ filialı),40.34875,49.835861,,True,,,,,,,
0Je2TdBouW5jrNxgsREmh,275,ATM RIM OGUZ SHEKI KARVANSARAY,ATM,"Şəki, M.F.Axundov küçəsi 185 (Karvansaray)",41.20065640081308,47.192696888477144,,False,,,,,,,https://images.ctfassets.net/rckhx7d9app2/2A5SHXJSt0isMb7FrlOIlo/a4b21926815494cde430ef634ac691dd/0d62f455-ea89-4d6e-bd6a-ecaaa7deda0d.jpg
0LaRQTTiX8s3qgcaNgRSO,2241,ATM CNV ICHERI SHEHER METRO,ATM,Səbail r. İstiqlaliyyət küç. İçərişəhər metro st.,40.36604214110201,49.831421807616906,,True,,,,,,,
7ivieR977v6iOOVTowTG2H,2278,ATM CNV ARAZ M. BADAMDAR REC.,ATM,Səbail r. Badamdar qəs. T. Məmmədov küç. 3,40.338415,49.807376,,True,,,,,,,
2jB5sKtNXwYX5GGQyhc902,2316,ATM CNV BRAVO BAYIL 20SAHE REC,ATM,"Bakı ş. Səbail rayonu, Şahlar Allahverdiyev küçəsi 6B (Bravo Bayıl 20 Sahə)",40.329151,49.818423,,True,,,,,,,
VeR2LovnGVhPcuWdTz5uA,2382,ATM CNV BAYIL BAZARSTORE WR,ATM,"Səbail r., Badamdar qəsəbəsi 1-ci yaşayış massivi 1 (Bazarstore bayıl)",40.342512,49.839394,,True,,,,,,,
2JqyeY3Dww4gFM5VUpBA5X,2354,ATM CNV AZERTAC BUL-BUL WR,ATM,"Bakı, Səbail rayonu, Bülbül prospekti 18 (""Azərtac"" Məlumat agentliyi)",40.374854,49.843493,,True,,,,,,,
GkfYGUImCIV5Tl8yo9Wf9,2355,ATM CNV MILLI KITABXANA WR,ATM,"Bakı, Səbail rayonu, Xəqani küçəsi 29 (M.F.Axundov adına Azərbaycan Milli kitabxanası) ",40.374048,49.846533,,True,,,,,,,
5gOnHnLT8alcEDyyG72rTJ,674,ATM CNV BIBIHEYBAT MEYDAN,ATM,"Bakı, Səbail rayonu, Məktəb küçəsində (Meydan)",40.30629905393148,49.82161226889155,,False,,,,,,,
4gXiPn8J7AeVpC0lTtWh39,2497,ATM CNV DANIZ MALL RECYCLE,ATM,"Səbail r., Neftçilər pr. 26a (Dəniz Mall)",40.35821,49.836562,,True,,,,,,,
4w7qgRPICCR4AxsD9VHhED,1074,ATM CNV ANTI INHISAR ZARDABI,ATM,"Bakı, Yasamal rayonu , İİN, Antiinhisar Müdafiəsi Dövlət xidməti - H.Zərdabi 88A",40.399647,49.805971,,False,,,,,,,
4crMxi467y5P6bxZwRbYv2,1719,ATM CNV ARAZ MARKET E.A.,ATM,"Bakı şəh.,Yasamal rayonu Şəhriyar küç. 6, ""Megacity"" yaşayış kompleksinin yanı",40.377575164334566,49.81249418650818,,False,,,,,,,
3XzYtFLsWbvxXZHTooFgDD,2184,ATM CNV ASAN 3 YASAMAL NR,ATM,"Yasamal r., Şərifzadə küç., 39",40.37897,49.804217,,True,,,,,,,
qpE9jz1b3WRZx2OiPHmhr,2197,ATM CNV SHARIFZADE BRANCH NR,ATM,"Bakı, Yasamal rayonu, Şərifzadə küçəsi, 217/23 (Şərifzadə filialı)",40.397041,49.801378,,True,,,,,,,
2RLYj8YCldOh1ndPRWmv7m,2207,ATM CNV AVROMART NIZAMI METRO NR,ATM,"Yasamal r., Shamil Azizbeyov 88 (Xarici İshler Nazirliyin arxasi)",40.378192,49.833945,,True,,,,,,,
1eqDKrvYrCVFfkfLwPZzUo,2217,ATM CNV BAZARSTO MIDA NR,ATM,"Yasamal r., MİDA Yaşayış kompleksi",40.376566,49.796424,,True,,,,,,,
5MHkyusq5Q5FZl3tTKHjbe,2240,ATM CNV ARAZ MARKET STATISTIKA NR,ATM,"Yasamal r., İnşaatşılar pr. 31 (Araz market)",40.383982,49.823015,,True,,,,,,,
78OHymbtdWvu4n1p1Lv7NI,2242,ATM CNV BRAVO Y/YASAMAL NR,ATM,"Baklı ş. Yasamal r., Y/Yasamal qəs. Əsəd Əhmədov küçəsi (Bravo yeni yasamail)",40.39410703610893,49.79481143348264,,True,,,,,,,
71ONyBww14QA1aBvEB634P,2259,ATM CNV TORPAQ KOMITESI NR,ATM,"Yasamal rayonu, Ələkbərov küçəsi 93 (Torpaq komitəsi)",40.3898188,49.8149438,,True,,,,,,,
6iQ16hPz7ZLgI1lmAPmRS8,2269,ATM CNV NIZAMI MALL NR,ATM,Yasamal r. Salatın Əsgərov küç. 163 (Nizami Mall),40.37881,49.830601,,True,,,,,,,
1gyfp5CtQQK06Y5T9mWPWi,2275,ATM CNV ARAZ M. PARALEL 6 NR,ATM,Yasamal r. Naxçıvan küç. 15,40.383234,49.825547,,True,,,,,,,
2uDnhlepINdD3hvmyQY7Tv,2359,ATM CNV MARKAZI KLINIK WR,ATM,"Bakı, Yasamal rayonu, Parlament prospekti (Mərkəzi Kliniki Xəstəxana)",40.361371,49.824619,,True,,,,,,,
4XXZ2Nhti9Vb82rUaYOiBr,2373,ATM CNV ARAZ MARKET YENI YASAMAL WR,ATM,Bakı ş. Əsəd Əhmədov 41 (Araz market Yeni Yasamal),40.38757,49.787599,,True,,,,,,,
5CJqrMefrItsuIYxh7Fq1,2387,ATM CNV ARAZ MARKET ZARDABI WR,ATM,"Bakı, Yasamal rayonu, H.B.Zərdabi prospekti 593-cü məhəllə (Araz market üç taclı bina)",40.385901,49.80839,,True,,,,,,,
2LT2zS6VB22BcS8PCBxAvP,2388,ATM CNV BAZARSTORE Z XALILOV WR,ATM,"Bakı, Yasamal rayonu, Z.Xəlilov küç.60 (""Bazarstore"" market)",40.385992,49.810802,,True,,,,,,,
1m0CUeXIEJmDGK2D1jViZ9,407,ATM CNV RAHAT M. YENI YASAMAL,ATM,"Bakı, Yasamal r-nu, D.Bünyatzadə 15 (Rahat market)",40.390197,49.793972,,False,,,,,,,
47bh7U7xqIonfzQHHJsqpC,2397,ATM CNV SHARIFZADE BRANCH 24/7 GRG,ATM,"Bakı, Yasamal rayonu, Şərifzadə küçəsi, 217/23 (24/7 zona)",40.397041,49.801378,,True,,,,,,,
2SR7wFaEUd3F2gB1wihgS6,2413,ATM CNV ARAZ M. SHARIFZADE WR,ATM,"Bakı ş. Yasamal r-nu, Şərifzadə küç. 100 (""Araz"" market)",40.382067,49.804137,,True,,,,,,,
56EXGnoeoq5QXPfidHzo3m,2266,ATM CNV BAKU ELEKTRONIKS INSHATCHILAR M. WR,ATM,"Bakı , Yasamal r., Şərifzadə 3152-ci məh. (Baku elektroniks inşaatçılar m/s)",40.388584,49.802651,,True,,,,,,,
4OworUAn2JMFZlqybhx8Jp,2418,ATM CNV GRANDMART YASAMAL WR,ATM,"Bakı ş, Yasamal Rayonu, İ.Qutqaşınlı 507-511 küçəsində yerləşən (Grandmart supermarket)",40.368285,49.821202,,True,,,,,,,
3u7oLm2QyxkpGKtUifLQql,2374,ATM CNV IMPLAND S.M. ALAKBAROV WR,ATM,"Bakı, Yasamal rayonu, Ələkbərov küçəsi 5 (İmpland klinikası)",40.380324,49.817222,,True,,,,,,,
3PkPwbAAbOO77wOevz5j7R,1275,ATM CNV RAHAT MARKET C. SALIMOV,ATM,"Bakı şəhəri, Yasamal r-nu, C.Səlimov, küç. 3 (Rahat market 24/7)",40.400967,49.821943,,False,,,,,,,
7jrvvqYhrhStlC90qy9L69,209,ATM CNV BOLMART MUSABAYOV  ELMLER,ATM,"Bakı ş, Yasamal, 574 Əbdürrəhim bəy Haqverdiyev küç, Musabəyov parkın yanında (Bolmart Elmlər) 24/7",40.38008133079799,49.8102364552804,,True,,,,,,,
RT1tuXUBRmWHr3kxiMP7t,495,ATM CNV POCHT 25 Y. SAFAROV 8,ATM,"Bakı, Xətai rayonu, Yusif Səfərov küçəsi 8 (25 saylı poçt)",40.378044,49.865506,,False,,,,,,,
6721YqDPU4SDRyK7JWnSSv,843,ATM CNV POCHT 32 KEND AHMEDLI,ATM,"Bakı, Xətai rayonu, Ş.Əhmədov küçəsi (Kənd Əhmədli, 32 saylı poçt şöbəsi)",40.38556199991127,49.94423270042216,,False,,,,,,,
4ioBL317tRn1pCOXFCtmha,1739,ATM CNV XATAI BRANCH 2,ATM,"Bakı şəhəri, Xətai r-nu, Nobel pr. 23, (ABB  Xətai filialı  ( ASAN-2 xidmətinin yanı ))",40.3791493,49.8786948,,False,,,,,,,
6iinU8nfH8399VqKyp26aN,384,ATM RIM OGUZ SHEKI MARKET,ATM,"Şəki, Məmmədəmin Rəsulzadə prospekti (Market)",41.2035946,47.1789536,,False,,,,,,,https://images.ctfassets.net/rckhx7d9app2/3jnV7iBm169RbGDHVE4PAb/e8939317824942de4f06c46e8cb5671d/74b8ede1-7d66-4930-b580-d4632a691c93.jpg
3dE3CzYt2nJSSl5lcbjkxO,2180,ATM CNV XATAI BRANCH 3,ATM,"Bakı şəhəri, Xətai r-nu, Nobel pr. 23, (ABB Xətai filialı ( ASAN-2 xidmətinin yanı ))",40.3791493,49.8786948,,True,,,,,,,
pDerBbgWur0zswpXnfZcq,1774,ATM CNV XATAI BRANCH 4,ATM,"Bakı şəhəri, Xətai r-nu, Nobel pr. 23, (ABB Xətai filialı ( ASAN-2 xidmətinin yanı ))",40.3791493,49.8786948,,False,,,,,,,
24YquM08sjcKzxkUHsYY6i,1802,ATM CNV PREMIUM MART GUNESHLI,ATM,"Bakı şəhəri, Xətai r-nu, Günəşli qəs., İ.İsmayılov küç., 8, ""Premium"" market",40.36000237671684,49.96998251947099,,False,,,,,,,
1L3dPCvnjS1tQqjpnoIYWn,1966,ATM CNV OBA MARKET M.HADI,ATM,"Xətai rayonu, Məhəmməd Hadi küçəsi 134 (Oba market)",40.392393,49.953553,,False,,,,,,,
3tFovIWywiAWXV0ic1lnpU,2203,ATM CNV BRAVO AHMADLI NR,ATM,"Xətai r., Ramiz Quliyev küç., 4 (Bravo Əhmədli - Radiofactory)",40.374662,49.944575,,True,,,,,,,
3RUMuoe6al69cT3ITiHJuz,2295,ATM CNV ARAZ M. XAZAR DAIRE,ATM,"Xətai r., Gəncə pr. 41 (Araz market)",40.363397,49.960477,,True,,,,,,,
76prxa3bITWmCKOgws5zRt,2341,ATM CNV BIZIM M. SARAYEVO WR,ATM,"Bakı, Xətai rayonu, Sarayev küçəsi 8C (Bizim market)",40.386636,49.964723,,True,,,,,,,
1Ad2TXsQXyyX12avHdiZd6,2401,ATM CNV SOCAR ZIG GANCLIK PARKI WR,ATM,"Bakı, Xətai rayonu, Zığ şos. Gənclik parkı (Socar YDM)",40.355309,49.953542,,True,,,,,,,
3pxyTC3TKvbymDqLlaTZbz,2234,ATM CNV SANAYE BRANCH NR,ATM,"Bakı, Xətai r-nu, Babək prospekti 1145 məhəllə (ABB Sənaye filialı)",40.388477,49.877889,,True,,,,,,,
4646k0n8lQInvaTBeHO5kA,2195,ATM CNV AZERIGAZ Y.SAFAROV 23 NR,ATM,"Bakı, Xətai rayonu, Yusif Səfərov küçəsi 23 (""Azəriqaz"" QSC)",40.3848192,49.863234,,True,,,,,,,
7GhbyeR2uDPtFkLMwBwlrr,1742,ATM CNV ARAZ MARKET SHIXLINSKI,ATM,"Bakı şəhəri, Xətai rayonu, ​General Əliağa Şıxlinski küçəsi, 1b/1 (Araz market)",40.3811,49.965156,,False,,,,,,,
AqEqTzDb6a8yoghagQuGU,2193,ATM CNV MEGASTORE AHMADLI NR,ATM,"Xətai r., Əhmədli qəs. R.Məmmədov ""Meqastore"" Ukrayna dairəsi",40.372913,49.944703,,True,,,,,,,
36Q2BjxDfXfBI3SkmG3ZLp,602,ATM RIM GEN GEDEBEY DADASH M,ATM,"Gədəbəy, Səməd Vurğun 46B, (Market)",40.57215910675314,45.80605010948782,,False,,,,,,,https://images.ctfassets.net/rckhx7d9app2/2Xkm3DoBInEEcNEZtHtpM0/7c863a9291b802941fe4842285739bc9/WhatsApp_Image_2023-08-17_at_14.41.57__2_.jpeg
IuVzd64wb9opggWB1xkkI,314,ATM CNV A PLUS MARKET AHMEDLI,ATM,"Bakı şəhəri, Xətai rayonu, General Şıxlinski (""A+"" supermarket)",40.377972,49.959938,,False,,,,,,,
2YaEyImkuStNCCxmZZDtIY,2534,ATM CNV ASAN 5 H.ALIYEV DN,ATM,"Bakı ş., Nizami r-nu,  H.Əliyev prospekti, 115 (ASAN5)",40.417581,49.908305,,True,,,,,,,
7lD4pcr4CngFGXQP5TGkb6,2532,ATM CNV ASAN 2 AMAY DN,ATM,"Bakı şəhəri, Xətai rayonu Nobel pr. 23 (ASAN 2  - Amay)",40.3792131,49.8790394,,True,,,,,,,
7CShv22h7sbsXT3fdyb2EU,206,ATM CNV MARDAKAN BRANCH 2 NR,ATM,"Bakı, Xəzər rayonu , Mərdəkan qəsəbəsi, Yesenin küçəsi 8 (ABB Mərdəkan filialı)",40.487517,50.159114,,True,,,,,,,
67EMc6hY2oK1Acf3C8ss2s,224,ATM CNV OBA MARKET MARDAKAN,ATM,"Bakı, Xəzər rayonu , Mərdəkan qəsəbəsi, B.Əliyev küçəsi 15/1 (Oba Market) ",40.48192158158108,50.15694577703763,,False,,,,,,,
4rmEOgEYXZq3h3JrJ4yjUa,247,ATM CNV ARAZ M. BINA Q.,ATM,"Bakı ş. Xəzər r-nu, Binə qəs., Ə.İsazadə küç. İmam Həsən məsçidin yanı (Araz market - 3)",40.424564,50.102718,,False,,,,,,,
442UEp3f5AFTGeVS6X0SnU,249,ATM CNV ARAZ MARKET BUZOVNA,ATM,"Bakı, Xəzər rayonu , Buzovna qəsəbəsi, N.Eyvazov küçəsi, ""Araz"" market ",40.51689963143232,50.10228723917505,,False,,,,,,,
pu3uIxbK7N0OzSmjzzKID,311,ATM CNV OBA MARKET ZAGULBA ,ATM,"Bakı, Xəzər rayonu, Buzovna qəsəbəsi, Rasim İmanov küçəsi 24 (Oba Market)",40.52771759033203,50.097679138183594,,False,,,,,,,https://images.ctfassets.net/rckhx7d9app2/7HfhziG0vwKACxFboY6iDG/223bb5fa01494c95f7eb7902611af027/8882ba3b-dbe6-4861-a9f5-0aef11b565b0.jpg
55BMgBFvTygrKGiUUS46YZ,315,ATM CNV ARAZ MARKET SHUVELAN,ATM,"Şüvəlan qəs., Lev Sarçuk küç., 15",40.4961051940918,50.198326110839844,,False,,,,,,,https://images.ctfassets.net/rckhx7d9app2/4caBl4Agh6SmVj79WyNSeO/b74c9982f8022ed66681cd1d2ff0ea4f/1211627a-7276-4e41-8310-1bdd93e3e0fc.jpg
6OyYRbV3c55LzEX3b95zsX,316,ATM CNV SUPERMARKET ZIRE ,ATM,"Bakı ş. Xəzər rayonu, Zirə qəs. 58-ci sahə (Super Market)",40.375587463378906,50.285831451416016,,False,,,,,,,https://images.ctfassets.net/rckhx7d9app2/uBEb8a0m2LG6cIX6UsYtr/bfb2f385e1086de0ab278125ccb9ab58/bfa083ff-8a6b-4d0c-9f03-b737c1da0aab.jpg
2mgXr540jpEh2aNjiEZzYW,400,ATM CNV GUNESH MARKET SHUVALAN ,ATM,"Bakı ş,Xəzər r-nu, Şüvəlan qəs. İldırım küç. 114A (market)",40.48486675015568,50.192971295497784,,False,,,,,,,
5UXEtxtlFqCGCvmww37rlL,472,ATM CNV SOCAR N3 QALA,ATM,"Bakı, Xəzər r-nu,  Bakı-Mərdəkan-Qala yolayrıcının cənub-qərb hissəsi (""Socar"" YDM )",40.47160910262088,50.10430247644211,,False,,,,,,,
6hRbrEe7VvbBam5TrDRBi5,1089,ATM CNV 5+ MARKET ALBALI BUZOVNA ,ATM,"Bakı, Xəzər r. Buzovna qəs. M. Namazov küç. 83C giriş 1",40.52619628304033,50.06774970038911,,False,,,,,,,
2ioEgofUllTZsc6RF737zv,25,ATM CNV APTEK 63 BUZOVNA ,ATM,"Xəzər ray, Buzovna qəs., sahə 74d (Aptek 63)",40.52058792114258,50.04142379760742,,False,,,,,,,https://images.ctfassets.net/rckhx7d9app2/whLrw7sQ3Q8S1XB2Ot922/223ca96348653708c43490330809d0d8/25_sayl__ATM.jpg
1kfeyZqITwPWlTvYr0snCQ,1552,ATM CNV SOCAR AEROPORT SHOSSE.,ATM,"Bakı, Xəzər rayonu , Yeni Suraxanı Bakı-Aeroport yolu (Socar YDM)",40.440682,50.013566,,False,,,,,,,
5z09dPgTy18WUQQ7IZB4k4,2016,ATM CNV GRANDMART BINA,ATM,"Bakı ş, Xəzər rayonu, Mərdəkan şossesi, Binə atçılıq mərkəzi ilə ezbəüz  (Grandmart supermarket)",40.462781,50.082981,,False,,,,,,,
4qvpLwMee3g5EliBZzlNct,2246,ATM CNV RAHAT M. GALA NR,ATM,"Xəzər r., Qala yolu (Rahat market)",40.474693,50.109614,,True,,,,,,,
3ovJBBCsRUzZqCev0rxWN1,2257,ATM CNV RAHAT M. MARDAKAN NR,ATM,"Xazar r., Mərdəkan qəsəbəsi, Yesenin küçəsi,. “RAHAT” market",40.49036870664834,50.14838320090493,,True,,,,,,,
4j3IRg9fR95u3L3DAzhSOv,2405,ATM CNV MARDAKAN BRANCH 1 NR,ATM,"Bakı, Xəzər rayonu , Mərdəkan qəsəbəsi, Yesenin küçəsi 8 (ABB Mərdəkan filialı)",40.487517,50.159114,,True,,,,,,,
5kveM809wHr7kmfuOf5mS,2503,ATM CNV HAVA LIMANI SHIMAL TERMINAL GRG,ATM,"Bakı ş., Xəzər rayonu , Binə qəsəbəsi, (H.Əliyev adına Beynəlxalq Hava Limanı, Şimal Terminalı )",40.46533407768805,50.05258908463963,,True,,,,,,,
5gO7nWZoI4TrpswjZHjyAF,2164,ATM CNV HAVA LIMANI CENUB TERM. NR,ATM,"Bakı şəhəri, Xəzər r-nu, Binə qəs., H.Əliyev adına Beynəlxalq Hava Limanı",40.4626571452584,50.04960511045073,,True,,,,,,,
7bvJMuIyRGZ6fylNojD2OS,2494,ATM CNV HAVA LIMANI ABB BR. GRG,ATM,"Bakı ş.Xəzər r., Binə qəs., H.Əliyev adına Beynəlxalq Hava Limanı (ABB filialı)",40.4626571452584,50.04960511045073,,True,,,,,,,
7CIvG8MQpRLkiXg00MdCSk,958,ATM CNV BOLMART ZIRE QES.,ATM,"Bakı ş. Xəzər rayonu, Zirə qəsəbəsi (Bolmart)",40.419333,50.261524,,False,,,,,,,
5UAbeQ6biQ3Cv2XJQPxzdV,838,ATM CNV OBA BUZOVNA QES.,ATM,"Bakı, Xəzər, Qəsəbə Buzovna, Ruhulla Axundov küçəsi, 408 (Oba market)",40.520779,50.110481,,False,,,,,,,
4tjumneaRcmciGsgvsZMwU,2019,ATM CNV OBA MARKET ZIRA,ATM,"Bakı ş, Xəzər rayonu, Zirə qəs. Babayev küç. (Oba market)",40.365368113072066,50.29465794505824,,False,,,,,,,
5lLMjPCTQPKe8XzqDjEUjm,1358,ATM RIM XIR RAHAT MARKET BINAGADI ,ATM,"Bakı ş. Mehdiabad qəs. Binəqədi şossesi, 3-cü mədən, korpus 119/55 (""Rahat"" market)",40.46753257446363,49.84231164928107,,False,,,,,,,
PU83gSrHTQ1gfRRBRVDlc,229,ATM CNV METAK BAKSOL ,ATM,"Bakı, Binəqədi r-nu, Baksol yolu (Metak şirkəti)",40.432354,49.86671,,False,,,,,,,
1jFVbbZdo6ReHbkIimUgDY,747,ATM CNV RAHAT MARKET 9 MKR ,ATM,"Bakı, Binəqədi rayonu, 9-cu mikrorayon, M.Cəlal küçəsi,(""Rahat"" market) ",40.42578125,49.818824768066406,,False,,,,,,,https://images.ctfassets.net/rckhx7d9app2/63yNCLvy2N9S7bQUD3VyAQ/3b46882b987d438c85ac27cab26bd5b2/8c0a75b2-16c7-42ae-a5b1-3e7d7b50bdce.jpg
x1apLgo0ZFuwFuImXduay,756,ATM RIM YEV SHEKI SARICA OBA,ATM,Şəki,40.8756585,47.3442316,,False,,,,,,,https://images.ctfassets.net/rckhx7d9app2/2hPwEdP9sgOrpwPYQOYOfL/b56bcb0f7f079b510113f78153b153a3/3ce64538-ff69-432a-b39f-6ef069e59626.jpg
5u13hS24jhTUdKmr6SmUN4,782,ATM CNV BAKI TM BUZOVNA ,ATM,"Bakı, Xəzər rayonu, Buzovna qəsəbəsi, Rasim İmanov küçəsi (Bakı Ticarət Mərkəzi) ",40.5235595703125,50.09986114501953,,False,,,,,,,https://images.ctfassets.net/rckhx7d9app2/4e8X4AWp1yhjzM09ucECzL/7909cd1b4057042836e3f79f57b2858e/87bc262f-69b5-4b2b-a130-3ebacc72f407.jpg
2hhd5NoWtZ2KcPcyUzEwrg,282,ATM CNV NAQLIYYAT POLISI,ATM,"Bakı, Suraxanı r., Zığ qəs., Zığ-Hövsan yolu 2ci km (ARDİN Nəqliyyatda Baş Polisİd.)",40.346833,49.990538,,False,,,,,,,
2Tj1L5MwdsfVUlTCA2c3fh,295,ATM CNV ARAZ M. AMIRJAN,ATM,"Bakı, Suraxanı rayonu, Əmircan qəsəbəsi, keçid 1847 ",40.4125877,50.0025804,,False,,,,,,,https://images.ctfassets.net/rckhx7d9app2/5k2yMobH5IoSd4TrjCd2BE/785b1e53f900c7fa136083af60c14079/e657685a-2130-4494-bd6d-63fee0e751b7.jpg
5f8iKOeYz50RI6rro99O1g,888,ATM RIM GEN SHAMKIR,ATM,Şəmkir rayonunun Yeni Göyçə kəndi ərazisində (“Ayan” marketin binası),40.673725,45.949518,,False,,,,,,,https://images.ctfassets.net/rckhx7d9app2/nyYu4w9pUE3on0fv8XKRn/51dc27b97c3de2e14d0ddfba4e9ae6a2/7be3ae56-ba38-446e-a447-b642786af313.jpg
1uBHXWvj9enVP0iuCtHtun,679,ATM CNV XAZAR MARKET QARACHUXUR ,ATM,"Qaraçuxur qəsəbəsi, məhəllə 4057-4060,M.Fətəliyev küç., 15C",40.398562,49.976395,,False,,,,,,,
5XqGfquDYHd6bOLvBA0Xx,920,ATM RIM SHEKI BASH DEHNA,ATM,"Şəki, Böyük Dəhnə kəndi, ""Zirvə"" şadlıq evi",40.9760921,47.1216961,,False,,,,,,,https://images.ctfassets.net/rckhx7d9app2/73cI0GsneaJ6b8CSY0vUIf/77d89bbd53bca7a459f436900255cff4/d7ad32c7-caff-41ff-9de6-6faa1c9679c0.jpg
7fMmbFkfScN0XoUmbJJmhf,2279,ATM CNV ARAZ M. K.GUNASHLI NR,ATM,"Suraxanı r. Köhnə Günəşli qəs. İlqar Musayev küç., 56 D (24/7  ""ARAZ"" m.)",40.385005,49.971756,,True,,,,,,,
5ycdqHLjCsXb4uYqcXgz8b,2313,ATM CNV ARAZ M. HOVSAN WR,ATM,Bakı şəhəri Suraxanı rayonu Hövsan ŞTQ E. Məmmədov ev. 5K  ,40.360714,50.079949,,True,,,,,,,
6aE8WqYA557pHKw29amC8H,675,ATM CNV AMIRCAN BAZARSTORE,ATM,"Bakı, Suraxanı rayonu, Suraxanı qəsəbəsi, Qarabağ FK (BazarStore)",40.4209,49.9972,,False,,,,,,,
7JNcwwsUpVJpTyRwfRVwxP,671,ATM CNV ZIKH MARKET,ATM,"Bakı, Suraxanı rayonu, Ziğ qəsəbəsi, Zığ dairəsi (Market)",40.358718436343935,49.97771222518275,,False,,,,,,,
2DTD91UkgNaMDYoGrV4EBo,862,ATM CNV GALA ARAZ MARKET,ATM,"Bakı, Suraxanı rayonu, Qala qəsəbəsi (Araz market)",40.448878,50.161061,,False,,,,,,,
44o0a7vEWOYjmFmrQMqioV,1856,ATM CNV HOVSAN ARAZ MARKET,ATM,"Bakı şəhəri, Suraxanı r-nu, Hövsan qəsəbəsi,         "" Araz "" market",40.360341,50.07564,,False,,,,,,,
6E1bYoQ3nN4hkVBxQPRxcq,821,ATM CNV TURKAN OBA MARKET 1,ATM,"Bakı, Xəzər rayonu, Türkan qəs. Xanlar  küç. (Oba market-1)",40.36576372616282,50.2140806361463,,False,,,,,,,https://images.ctfassets.net/rckhx7d9app2/3A98leVUtDJiG6VZvpkv7q/7c0ee9b93938ab01b4f974c264b89212/8873b909-d292-455b-b636-f22d187041f8.jpg
45KTkQEe90bYBat0UOHf5c,864,ATM CNV TURKAN OBA MARKET 2,ATM,"Bakı, Xəzər rayonu, Türkan qəs. Xanlar  küç. (Oba market-2)",40.365346,50.223002,,False,,,,,,,
2YQjGlGBNBWSXFN0m9gsPw,1795,ATM CNV QARACHUXUR MEHBALIYEV OBA ,ATM,"Bakı, Suraxanı rayonu, Qaraçuxur qəsəbəsi, Əhməd Mehbalıyev (Oba market)",40.391983,49.972153,,False,,,,,,,
4xT4zJAtRndTCm0UuQA55c,672,ATM CNV GURGAN OBA MARKET,ATM,"Bakı, Suraxanı rayonu, Gürqan qəsəbəsi, E.Hüseynov küçəsi (Oba market)",40.39552044995272,50.33845869512729,,False,,,,,,,
4ZfMI4VzXYpjBL5KDOTWq1,360,ATM CNV SURAXANI AMIRCAN OBA,ATM,Suraxanı ray Əmircan qəs Tofiq Bayram küçəsi 23 (Oba market),40.42225998815181,49.987756393493,,False,,,,,,,
2DN4uV3Rk1yWB55i5sd7kd,598,ATM CNV PIRALLAHI ARAZ MARKET,ATM,"Bakı ş. Pirallahı r-nu, Araz market",40.45951461791992,50.33545684814453,,False,,,,,,,
5QKQqNVpN9THpIrTRQaVnT,2294,ATM CNV PIRALLAHI BRANCH NR,ATM,"PirAllahı r., S. Murtuzəliyev küçəsi (ABB-nin Pirallahı filialı)",40.455348,50.337,,True,,,,,,,
1wV6bPGI6UBDN0hfb80wwF,217,ATM CNV PIRALLAHI OBA MARKET,ATM,"Xəzər r., Pirallahı qəsəbəsi, (Oba market)",40.468143,50.326045,,False,,,,,,,
